id,topic_number_topiccode,topic_id_topicid,title_topictitle,short_title_derived_first_50_chars_of_topictitle,component_component,component_full_name_derived_expanded_from_component_abbreviatio,command_command,program_program,program_type_derived_extracted_from_program_field,solicitation_solicitationtitle,solicitation_number_solicitationnumber,cycle_name_cyclename,release_number_releasenumber,solicitation_phase_derived_extracted_from_cyclename_using_regex,status_topicstatus,topic_status_topicstatus_duplicate,proposal_window_status_calc_based_on_current_date_vs_start_end_,days_until_close_calc_topicenddate_current_date,days_since_open_calc_current_date_topicstartdate,urgency_level_calc_based_on_days_until_close_thresholds,open_date_topicstartdate_converted_to_mm_dd_yyyy,close_date_topicenddate_converted_to_mm_dd_yyyy,open_datetime_topicstartdate_duplicate,close_datetime_topicenddate_duplicate,duration_days_calc_topicenddate_topicstartdate,pre_release_start_topicprereleasestartdate,pre_release_end_topicprereleaseenddate,pre_release_duration_calc_prereleaseenddate_prereleasestartdate,created_date_createddate,updated_date_updateddate,modified_date_modifieddate,last_activity_date_calc_max_of_updateddate_modifieddate_topicqa,qanda_start_topicqastartdate,qanda_end_topicqaenddate,qanda_tpoc_start_topicqatpocstartdate,qanda_tpoc_end_topicqatpocenddate,qanda_status_topicqastatus,qanda_status_display_topicqastatusdisplay,qanda_open_topicqaopen_boolean,qanda_window_active_calc_current_date_within_qa_start_end_range,days_until_qanda_close_calc_topicqaenddate_current_date,total_questions_topicquestioncount,published_questions_noofpublishedquestions,unpublished_questions_calc_topicquestioncount_noofpublishedques,qanda_response_rate_calc_publishedquestions_totalquestions_perc,hasqa_derived_1_if_topicquestioncount_0,qa_data_topicquestioncount_duplicate,qanda_content_fetched_from_questions_endpoint_and_formatted,qanda_last_updated_ext_latest_answeredon_date_from_qanda_respon,technology_areas_details_technologyareas_array_joined,technology_areas_count_calc_count_of_comma_separated_values,primary_technology_area_derived_first_item_in_technologyareas,tech_modernization_details_focusareas_mapped,modernization_priorities_details_focusareas_array_joined,modernization_priority_count_calc_count_of_pipe_separated_value,keywords_details_keywords,keywords_count_calc_count_of_semicolon_separated_values,primary_keyword_derived_first_keyword_before_semicolon,itar_controlled_details_itar_boolean_to_yes_no,requiresitar_derived_1_if_itar_is_yes_else_0,security_export_details_itar_duplicate,security_clearance_required_analysis_keywords_in_description,objective_details_objective_with_html_removed,objective_word_count_calc_space_separated_word_count,key_requirements_details_objective_duplicate,description_details_description_with_html_removed,description_word_count_calc_space_separated_word_count,description_length_calc_character_count,has_technical_details_derived_1_if_description_500_chars,isxtech_analysis_xtech_mentioned_in_description,is_xtech_analysis_xtech_keyword_search_duplicate,prize_gating_derived_yes_if_xtech_detected,competition_type_derived_based_on_xtech_and_dp2_detection,phase_i_description_details_phase1description_with_html_removed,phase_ii_description_details_phase2description_with_html_remove,phase_iii_dual_use_details_phase3description_with_html_removed,has_commercial_potential_derived_1_if_phase3description_exists,references_details_referencedocuments_array_formatted,reference_docs_details_referencedocuments_duplicate,reference_count_calc_count_of_semicolon_separated_refs,has_references_derived_1_if_references_exist,phase_phasehierarchy_parsed_or_default_phase_i,phases_available_phasehierarchy_config_displayvalue_joined,phase_types_phasehierarchy_parsed_pipe_separated,phase_count_calc_count_of_phase_types,is_direct_to_phase_ii_analysis_dp2_or_direct_to_phase_ii_in_tex,phase_funding_text_extraction_dollar_amounts_from_phase_descrip,funding_max_text_extraction_maximum_dollar_amount_found,award_amount_phase_i_text_extraction_dollar_amount_from_phase1d,award_amount_phase_ii_text_extraction_dollar_amount_from_phase2,award_duration_phase_i_text_extraction_months_from_phase1descri,award_duration_phase_ii_text_extraction_months_from_phase2descr,total_potential_award_calc_sum_of_all_phase_amounts_found,funding_type_analysis_cost_plus_or_fixed_price_keywords,topic_pdf_download_gen_topics_api_public_topics_id_download_pdf,pdf_link_gen_topic_pdf_duplicate,solicitation_instructions_download_gen_submissions_api_public_d,solicitationinstructionsurl_gen_solicitation_download_duplicate,component_instructions_download_gen_component_specific_download,componentinstructionsurl_gen_component_download_duplicate,has_pdf_derived_1_if_pdf_link_exists,has_solicitation_instructions_derived_1_if_solicitation_link_ex,has_component_instructions_derived_1_if_component_link_exists,solicitation_instructions_version_baaprefaceuploadtitle,component_instructions_version_baainstructions_filename_match,tpoc_topicmanagers_where_assignmenttypetpoc_names_joined,tpoc_names_topicmanagers_name_array,tpoc_emails_topicmanagers_email_array,tpoc_centers_topicmanagers_center_array,tpoc_count_calc_number_of_tpocs,has_tpoc_derived_1_if_tpoc_exists,show_tpoc_showtpoc_boolean,tpoc_email_domain_ext_domain_from_first_tpoc_email,owner_owner_field,internal_lead_internallead_field,sponsor_component_sponsorcomponent_or_component_fallback,evaluation_weights_evaluationweights_or_evaluationcriteria,selection_criteria_selectioncriteria,has_evaluation_criteria_derived_1_if_evaluation_weights_exist,historical_awards_historicalawards,previous_awards_count_previousawardscount,success_rate_successrate,competition_level_est_based_on_historicalawards_thresholds,year_sys_current_year,solicitation_year_ext_year_from_cyclename_using_regex,program_year_programyear,fiscal_year_calc_based_on_oct_1_fiscal_year_start,quarter_calc_calendar_quarter_from_topicstartdate,baa_preface_upload_id_baaprefaceuploadid,baa_preface_title_baaprefaceuploadtitle,is_release_preface_isreleasepreface_boolean,baa_instruction_files_baainstructions_filename_array_joined,baa_files_count_calc_length_of_baainstructions_array,has_baa_instructions_derived_1_if_baainstructions_exists,applicable_actions_applicableactions_array_joined,actions_count_calc_length_of_applicableactions,is_active_isactive_boolean,is_archived_isarchived_boolean,is_draft_isdraft_boolean,is_published_ispublished_boolean,allow_proposal_submission_allowproposalsubmission_boolean,is_open_for_submission_derived_1_if_topicstatus_is_open,proposal_requirements_proposalrequirements,submission_instructions_submissioninstructions,eligibility_requirements_eligibilityrequirements,has_special_requirements_analysis_special_keywords_detected,information_quality_calc_based_on_key_field_lengths,data_completeness_score_calc_percentage_of_filled_fields,last_scraped_sys_current_timestamp_eastern,search_tags_gen_component_program_status_combined,category_tags_analysis_tech_categories_from_keywords,priority_score_calc_multi_factor_scoring_algorithm,relevance_score_user_empty_for_custom_scoring,record_id_gen_topiccode_topicid_first_8_chars,unique_id_gen_cyclename_topiccode,tracking_number_trackingnumber_if_exists,version_version_or_default_1,imported_at
A: It depends for both components.&nbsp; The D2D can have internal batteries if it needs to support the design/implementation, however, the D2D is expected to be supported via external system power.&nbsp; With respect to an external antenna, its preferable&nbsp;to have an internal antenna, however, an external antenna most not hinder a dismounted solder&#39;s movement or increase the profile such that mission execution is compromised.

Q3 (05/04/2021): The target budget is $500, what volume of production are you looking for?
A: 1600 per Brigade Combat Team, however, theses number can vary depending on the Army&#39;s Basis-of-Issue Priorities (BOI).

Q4 (05/04/2021): For the dimensions requirement of the node, does this include batteries and external antennaâs?
A: It depends for both components.&nbsp; The D2D can have internal batteries if it needs to support the design/implementation, however, the D2D is expected to be supported via external system power.&nbsp; With respect to an external antenna, its preferable&nbsp;to have an internal antenna, however, an external antenna most not hinder a dismounted solder&#39;s movement or increase the profile such that mission execution is compromised.

Q5 (05/04/2021): We understand that the solution must be able to use licensed and unlicensed spectrum, what about shared bands? Can we consider CBRS band for our solution?
A: Yes.&nbsp; As long as CBRS supports an infrastructure-less&nbsp;implementation

Q6 (05/04/2021): How many users on a channel? Should PTT run on a different operating frequency?
A: The PTT functionality is your choice in terms of implementation, however, PTT ease of use and functionality should not be convoluted for the Soldier, it should be familiar&nbsp;and natural to use.

Q7 (05/04/2021): Is there a preference for voice communications? Voice over LTE? Voice over 5G?
A: This is the vendor&#39;s choice as long as an infrastructure-less solution is&nbsp; implemented.

Q8 (05/03/2021): Given this is a DP2 topic, can someone please point to the Technical Volume details/requirements/format including page length?  The ASO announcement for this topic specifies a 5-page limit on Phase I proposals, but is unclear on the length of the Technical Volume (Vol 2) for DP2 proposals.  There is mention of a template, but the link that is included in the BAA & ASO simply says ""template coming soon.""
A: I apologize for the confusion. For this DP2, the Technical Volume page limit is 15 pages. Please refer back to the overarching 21.4 BAA (see Appendix B) for what needs to be included in the technical volume. We do not have a template at this time but Appendix B has thorough instructions as to what needs to be included.

Q9 (05/03/2021): The instructions for the D2P proposal specify that the format and length requirements for the DP2 or Phase II proposal will be specified in the ASO.  I could only find the specified length and format of the phase I proposal in the ASO announcement.  Could you you please specify the length and format of the D2P proposals for this topic?  Also what is the maximum funding allowed for this D2P proposal and are matching funds permitted for this topic?
A: I apologize for the confusion. For this DP2, the Technical Volume page limit is 15 pages. Please refer back to the overarching 21.4 BAA (see Appendix B) for what needs to be included in the technical volume. We do not have a template at this time but Appendix B has thorough instructions as to what needs to be included. Max PoP is 18 months and $1,730,751.

Q10 (04/26/2021): Is this a uniform/ Suit?
A: No, this is hardware and software that protects your communications from electronic warfare attacks (e.g., jamming, etc.).

Q11 (04/25/2021): Want this Worn?
A: Can you please rephrase your question?

Q12 (04/16/2021): This topic only appears to be available in the system as a Direct to Phase II topic. Is this by design or will the topic be loaded into the proposal system with availability to be submitted as a Phase I topic.
A: We are only looking for Direct to Phase II&#39;s for this particular topic.

Q13 (04/05/2021): Are you interested in having a complete solution proposal or alternatively, a proposal that deals with aspects of the problem such as management of the data in contested environments?
A: We are looking for a complete solution.",,"Information Systems, Sensors",2,Information Systems,Network Command,Network Command,1,D2D; Jam Resistance; Frequency Agility; LTE,4,D2D,No,0,No,,Develop a Device-to-Device (D2D) squad-level communication platform that uses direct communications without network assistance of a radio access network (RAN). The D2D platform shall implement a cognitive agent controlling jamming mitigation strategies in contested electronic contested environments to provide increased resiliency and lethality for dismounted soldiers.,46,Develop a Device-to-Device (D2D) squad-level communication platform that uses direct communications without network assistance of a radio access network (RAN). The D2D platform shall implement a cognitive agent controlling jamming mitigation strategies in contested electronic contested environments to provide increased resiliency and lethality for dismounted soldiers.,"The current state of the art for dismounted soldier communications is the adoption of commercial wireless waveforms (e.g., IEEE 802.11x, LTE) or existing tactical radios. In the case of commercial wireless waveforms, the waveform provides high bandwidth throughput and scalability. However, commercial wireless waveforms are not developed to operate in electronic contested environments (i.e., Electronic Warfare). In the case of tactical radio waveforms, bandwidth throughput is minimal in comparison to commercial bandwidth speed. It does not support high bandwidth services or electronic warfare resiliency at the dismounted soldier level. In both cases, commercial and tactical radios, neither supports an evolving threat matrix or information-driven decision-making. Therefore, a solution is required that combines high-speed bandwidth throughput (i.e., commercial waveform) and resiliency in electronically contested environments.The offeror is required to provide an innovative solution that encompasses commercial high bandwidth and scalability. Some of these innovative solutions could be LTE-A, an intelligent cognitive agent, power-efficiency, and jamming mitigation electronics in a lightweight form-factor for dismounted operations. The following Key Performance Indicators (KPIs) for the said solution is below:The Dismounted D2D Node shall provide voice and data communications. Data communications are defined as Situational Awareness (SA), Command & Control (C2), and Video.The Dismounted D2D Node shall support Push-to-Talk (PTT) voice communicationsThe Dismounted D2D Node shall use direct communications without RAN coordinationThe Dismounted D2D Node shall use discovery without RAN coordinationThe Dismounted D2D Node shall use a UMTS Subscriber Identify Module (USIM) for provisioningThe Dismounted D2D Node shall use Cryptographic Algorithms for Bearer Channel SecurityThe Dismounted D2D Node shall use Secure Real-Time Transport Protocol (SRTP) for Media Channel SecurityThe Dismounted D2D Node shall use licensed or unlicensed frequency bandsThe Dismounted D2D Node shall support multicast for one-to-many (Group) communicationsThe Dismounted D2D Node shall support broadcast for one-to-many (Group) communicationsThe Dismounted D2D Node shall automatically establish direct communications up to 1000 D2D Nodes within rangeThe Dismounted D2D Node communication range shall be no less than 500 metersThe Dismounted D2D Node communication throughput shall be no less than 300 MbpsThe Dismounted D2D Node communications shall operate in degraded mode in contested environmentsThe Dismounted D2D Node shall be Low Probability of Intercept & Low Probability of Detection (LPI/LPD) The Dismounted D2D Node shall be Jam ResistantThe Dismounted D2D Node shall implement Frequency AgilityThe Dismounted D2D Node shall implement Machine Learning for Signal Feature ExtractionThe Dismounted D2D Node shall implement Machine Learning to direct and control Jammer Mitigation StrategiesThe Dismounted D2D Node shall implement Decoy Signal(s) outside of the frequency band of operation(s)The Dismounted D2D Node shall implement Adaptive Antenna TechnologyThe Dismounted D2D Node shall not exceed 6"" x 2"" x 3"" in volumeThe Dismounted D2D Node shall not exceed 0.5 lbsThe Dismounted D2D Node shall not exceed 2W budgetThe Dismounted D2D shall not exceed $500The Dismounted D2D Node shall use USB for external communications",466,3432,1,No,No,No,,"The offeror shall prepare and deliver a feasibility study at the end of phase 1. The feasibility study shall contain a proposed design concept, and implementation of a dismounted D2D communication platform based on system description and KPIs discussed and outlined in the description section. The proposed design concept and implementation shall be substantiated through modeling/simulation or other analytic means. When presenting modeling/simulation or analytic outcomes in the feasibility study, the offer shall include assumptions, caveats, and test data used substantiate conclusion(s) in the feasibility study.",The offeror shall provide 8-10 operational prototypes and demonstrate functionality at the end of phase 2. The network communication test scenarios shall consist of the following:8-10 node network where voice quality and data throughput rates will be scrutinized.Verification and Validation of the 1-26 KPIs outlined in the description section above.,"The offeror shall demonstrate the Dismounted D2D Communication Platform with a limited number of nodes that autonomously forms a network, processes Voice, C2, SA, and Video data traffic in support of dismounted soldiers. In terms of commercialization, the communications technology developed through this SBIR can be readily used in the IOT (Internet of Things) commercial market space. Several areas of the IOT include sensor networking and management, data off-loading for LTE (Long-Term Evolution) networks, and Smart Grid Communications.",1,"Liebhart, R. (2015). LTE for public safety. Chichester: Wiley-Blackwell.; Mumtaz, S., & Rodriguez, J. (2014). Smart Device to Smart Device Communication. Cham: Springer International Publishing.; [SPEC] 3GPP TR 22.803 - Feasibility study for Proximity Services (ProSe). (n.d.). Retrieved from https://itectec.com/archive/3gpp-specification-tr-22-803/.; Itectec.com. (2019). [SPEC] 3GPP TS 23.303 - Proximity-based services (ProSe); Stage 2 - iTecTec. [online] Available at: https://itectec.com/archive/3gpp-specification-ts-23-303/ [Accessed 2 Nov. 2019].; [SPEC] 3GPP TR 36.843 - Study on LTE device to device proximity services; Radio aspects - iTecTec. (2014). Retrieved November 2, 2019, fromhttps://itectec.com/archive/3gpp-specification-tr-36-843/","Liebhart, R. (2015). LTE for public safety. Chichester: Wiley-Blackwell.; Mumtaz, S., & Rodriguez, J. (2014). Smart Device to Smart Device Communication. Cham: Springer International Publishing.; [SPEC] 3GPP TR 22.803 - Feasibility study for Proximity Services (ProSe). (n.d.). Retrieved from https://itectec.com/archive/3gpp-specification-tr-22-803/.; Itectec.com. (2019). [SPEC] 3GPP TS 23.303 - Proximity-based services (ProSe); Stage 2 - iTecTec. [online] Available at: https://itectec.com/archive/3gpp-specification-ts-23-303/ [Accessed 2 Nov. 2019].; [SPEC] 3GPP TR 36.843 - Study on LTE device to device proximity services; Radio aspects - iTecTec. (2014). Retrieved November 2, 2019, fromhttps://itectec.com/archive/3gpp-specification-tr-36-843/",7,1,,,,,0,,,,,,,,,https://www.dodsbirsttr.mil/topics/api/public/topics/83819/download/PDF,https://www.dodsbirsttr.mil/topics/api/public/topics/83819/download/PDF,,,,,1,0,0,ARMY SBIR 2021.4 Instructions,,,,,,0,0,No,,,,ARMY,,,0,,,,,2025,,,,,,,No,,0,0,,0,No,No,No,No,No,0,,,,,,,2025-08-09 10:17:42,,,,,A214-034_83819,ARMY_SBIR_2021_P1_C4_A214-034,,1,2025-08-09 19:51:32.635591+00
